{
  "source": "HMRC monthly exchange rates",
  "period": "2026-08",
  "base": "GBP",
  "rates": {
    "AED": 4.9091,
    "ALL": 109.7955,
    "AMD": 488.5373,
    "AOA": 1224.3306,
    "ARS": 1975.2991,
    "AUD": 1.9112,
    "AWG": 2.3927,
    "AZN": 2.2724,
    "BAM": 2.292,
    "BBD": 2.6734,
    "BDT": 164.9731,
    "BHD": 0.5026,
    "BIF": 3987.4698,
    "BMD": 1.3367,
    "BND": 1.7262,
    "BOB": 14.4494,
    "BRL": 6.7858,
    "BSD": 1.3367,
    "BTN": 129.0145,
    "BWP": 18.2092,
    "BYN": 3.8578,
    "BZD": 2.6915,
    "CAD": 1.8835,
    "CDF": 3083.1421,
    "CHF": 1.0863,
    "CLP": 1250.6398,
    "CNY": 9.0479,
    "COP": 4314.3386,
    "CRC": 606.4354,
    "CUP": 32.0872,
    "CVE": 129.226,
    "CZK": 28.3253,
    "DJF": 238.003,
    "DKK": 8.7609,
    "DOP": 77.7899,
    "DZD": 177.9594,
    "EGP": 68.6327,
    "ERN": 20.0508,
    "ETB": 215.7325,
    "EUR": 1.1719,
    "FJD": 2.9874,
    "GEL": 3.5045,
    "GHS": 15.5267,
    "GMD": 98.7774,
    "GNF": 11726.9754,
    "GTQ": 10.1958,
    "GYD": 279.6097,
    "HKD": 10.4805,
    "HNL": 35.7968,
    "HTG": 174.7475,
    "HUF": 426.6463,
    "IDR": 23940.4179,
    "ILS": 4.0939,
    "INR": 129.0145,
    "IQD": 1751.2405,
    "ISK": 167.5923,
    "JMD": 212.116,
    "JOD": 0.9477,
    "JPY": 217.9907,
    "KES": 172.9979,
    "KGS": 116.8827,
    "KHR": 5399.6005,
    "KMF": 576.5395,
    "KRW": 1979.0292,
    "KWD": 0.4145,
    "KYD": 1.1117,
    "KZT": 624.7684,
    "LAK": 30210.7962,
    "LBP": 119912.1356,
    "LKR": 449.5212,
    "LRD": 241.9123,
    "LSL": 22.0219,
    "LYD": 8.577,
    "MAD": 12.5477,
    "MDL": 23.5148,
    "MGA": 5702.5645,
    "MKD": 72.1754,
    "MMK": 2806.6019,
    "MNT": 4799.6502,
    "MOP": 10.7949,
    "MRU": 53.3836,
    "MUR": 63.1965,
    "MVR": 20.665,
    "MWK": 2317.8777,
    "MXN": 23.2925,
    "MYR": 5.4633,
    "MZN": 85.3111,
    "NGN": 1838.2793,
    "NIO": 49.1887,
    "NOK": 12.8322,
    "NPR": 206.5199,
    "NZD": 2.2978,
    "OMR": 0.5141,
    "PAB": 1.3367,
    "PEN": 4.5467,
    "PGK": 5.98,
    "PHP": 82.5755,
    "PKR": 371.3406,
    "PLN": 5.0757,
    "PYG": 8093.9309,
    "QAR": 4.8657,
    "RON": 6.1387,
    "RSD": 137.5785,
    "RUB": 105.0552,
    "RWF": 1966.3449,
    "SAR": 5.0127,
    "SBD": 10.7861,
    "SCR": 18.7582,
    "SDG": 802.2719,
    "SEK": 12.9869,
    "SGD": 1.7262,
    "SLE": 30.6308,
    "SOS": 763.0606,
    "SRD": 50.4674,
    "SVC": 11.6963,
    "SZL": 22.0219,
    "THB": 45.203,
    "TMT": 4.6756,
    "TND": 3.9407,
    "TOP": 3.2194,
    "TRY": 63.1095,
    "TTD": 9.0721,
    "TWD": 43.3972,
    "TZS": 3528.7398,
    "UAH": 59.9097,
    "UGX": 4995.2411,
    "USD": 1.3367,
    "UYU": 53.6316,
    "UZS": 16045.3862,
    "VES": 984.1686,
    "VND": 35216.6818,
    "VUV": 159.1429,
    "WST": 3.6653,
    "XAF": 768.7193,
    "XCD": 3.6196,
    "XOF": 768.7193,
    "XPF": 139.8455,
    "YER": 318.1262,
    "ZAR": 22.0219,
    "ZMW": 24.5976,
    "ZWG": 35.8198
  },
  "note": "Authentic HMRC monthly CSV, units of foreign currency per GBP1; valid 2026-08. Source: https://www.trade-tariff.service.gov.uk/api/v2/exchange_rates/files/monthly_csv_2026-8.csv. Raw SHA256: 8da9e83a830282c94cbcb31779cbeb93d7a2a739d1bb898cbec62182b7b29fad. Filing dates and conversion month are separate recorded facts."
}
